{
  "schema": "seen-qwen-source-lock-v1",
  "created_at": "<RFC3339 UTC>",
  "seen": {
    "repository": "https://github.com/codeyousef/SeenLang",
    "baseline_commit": "0ee19d947ec3933b2fcbb862b8f115d7d2ef8e81",
    "compiler_sha256": "<sha256>",
    "runtime_abi": 1,
    "cuda_abi": 1
  },
  "model": {
    "id": "Qwen/Qwen3.8-27B",
    "revision": "1d4bf0f2ff6012fd82039f2fa52739d0dd7c60c0",
    "lock": "qwen-model-lock.json"
  },
  "references": [
    {
      "id": "qwen3.8",
      "repository": "https://github.com/QwenLM/Qwen3.8",
      "commit": "2ea10dc725823bf7c3e21ce8557cbe15245132ae"
    },
    {
      "id": "transformers-qwen3_5",
      "repository": "https://github.com/huggingface/transformers",
      "commit": "562cfd944ee1f20702cfb0f4404014ee27c24813",
      "paths": ["src/transformers/models/qwen3_5"]
    }
  ],
  "cuda": {
    "driver": "610.57.04",
    "toolkit": "13.3.73",
    "target": "sm_89"
  },
  "baselines": [],
  "datasets": [],
  "tools": []
}
